{
  "version": "docx-2025-11-24",
  "updated_at": "2025-11-24",
  "source": "docs/TO XIAOMA 20251124(2).docx",
  "rules": [
    {
      "id": "HR-001",
      "name": "任务成功率底线",
      "if": "路径预测任务成功率 < 0.60",
      "then": "一票否决",
      "description": "成功率低于 60% 的路径直接淘汰。"
    },
    {
      "id": "HR-002",
      "name": "有人平台生存率红线",
      "if": "任一有人平台战损概率 > 0.25",
      "then": "一票否决",
      "description": "有人平台战损率超过 25% 直接否决。"
    },
    {
      "id": "HR-003",
      "name": "无人平台消耗阈值",
      "if": "任一无人平台战损概率 > 0.60",
      "then": "一票否决",
      "description": "无人平台战损率超过 60% 直接否决。"
    },
    {
      "id": "HR-004",
      "name": "关键平台可用性",
      "if": "路径计划使用的平台处于故障/战损/失联状态",
      "then": "一票否决",
      "description": "关键平台不可用时路径无效。"
    },
    {
      "id": "HR-005",
      "name": "关键弹药可用性",
      "if": "路径计划消耗的特定型号弹药 > 实时库存",
      "then": "一票否决",
      "description": "弹药不足时路径无效。"
    },
    {
      "id": "HR-006",
      "name": "时空安全性",
      "if": "路径航路与己方禁飞区/导弹预设弹道/高危区域冲突",
      "then": "一票否决",
      "description": "冲突航路直接否决。"
    },
    {
      "id": "HR-007",
      "name": "任务时效性",
      "if": "路径执行完毕时间 > 任务最终失效时间",
      "then": "一票否决",
      "description": "超过时限直接否决。"
    }
  ]
}
